{
  "signatureBundleId": "exampleco-issued-signature-bundle-2026-03-24",
  "generatedAt": "2026-03-24T04:10:00Z",
  "signer": {
    "signerId": "oc-synthetic-signer",
    "keyId": "oc-synthetic-ed25519-001",
    "algorithm": "Ed25519",
    "publicKeyPath": "exampleco-synthetic-ed25519-public-key.pem"
  },
  "artifacts": [
    {
      "path": "proof-bundle.json",
      "sha256": "eeb31c3c6ccde25b9b3b03f9b74f65a8ef225e0596f55d68b88d214cb1601480",
      "signature": "1Lv2thJWzAJT1jvhXrOlo0N7Nx/u35uUW6lachoXm4hRN5k6BlLee0zwXwFWhq0cLKW7vuaG4rfujmwL18rrCQ=="
    },
    {
      "path": "trust-surface-report.md",
      "sha256": "d23ec5a6abb39727d6f763cb1498fc764a9b81a3e1793a29f876574b2b6ff226",
      "signature": "tLd8xD3xoZZtIYCjOCIEs6BKIkmalpabNZwN1eNX69+59088+xBniv+aCNekaBwReoCW/uyajRZca6Hcuob6Cw=="
    },
    {
      "path": "verification-result.json",
      "sha256": "5f29da4ecfb0fa738cf395260e12d0e08be7b0ade3015ece389edda4bf5edd8a",
      "signature": "iT3i1hUmKAndyzVLZij+bTZzxHl+4Y+qIQwgjg+R2kGzIZEunm2oZSocrsvrq8RprBeRG4driFGICcDiY3knDQ=="
    },
    {
      "path": "certificate.json",
      "sha256": "2d3912b7dd40042b02db575702b11af2e9113dbb909510ccd2fc76b63f4b2ad1",
      "signature": "2fcvwpSkIHXhzdg18HBz9bHlFwxlfbcVYA26ZOa0Nl5eRU66uyXvu6lY1kwJuAcXJo1XOgueiWMdqAzdNZAwAQ=="
    },
    {
      "path": "replay-bundle.json",
      "sha256": "713f7c93ce18ae12e5b5360bea3f92ba63d3d9bd35528f31e7a66fe298a22941",
      "signature": "2QkAD4ucGzZPp3pOA+qvDRt2EAXwMz6SBEQ+nGRAcs0M0nIEPQLHFCZc9OD8ASh9IleGl+NQjPEhVYeTleMMAw=="
    },
    {
      "path": "witness-receipt.json",
      "sha256": "6438aa1740ea7804a4a74a097d21a671f5e1ee31b9315bb7bf5e321083873f29",
      "signature": "/XDy74+QGy+xRSivp1FqkzlZoEfaRgF+oc41tGCni7txx/vAy+Mles2Fbjnvbn3IFoT64Z8Z2kJ3WMnUSwSRCQ=="
    },
    {
      "path": "revocation.json",
      "sha256": "b33ec3d98b726267b62575e412fd061f7fee16b45ab5e88431fd7ad2ffc56550",
      "signature": "NBAtCiaG/ragM4B8g7PBbYpqOWe5bgAAxuckBEafQzJg8XdmCAqDw8zmAEgysvsI1tGiu5wv76ETtRmj8575CA=="
    }
  ],
  "note": "Synthetic signature manifest for the public-safe issued ExampleCo corridor."
}
