{
  "signatureBundleId": "exampleco-issued-signature-bundle-2026-03-24",
  "generatedAt": "2026-03-24T04:10:00Z",
  "signer": {
    "signerId": "oc-synthetic-signer",
    "keyId": "oc-synthetic-ed25519-001",
    "algorithm": "Ed25519",
    "publicKeyPath": "exampleco-synthetic-ed25519-public-key.pem"
  },
  "artifacts": [
    {
      "path": "proof-bundle.json",
      "sha256": "0dc1057e7ff2db1bcf97039eb9c4aecc92bdcf229a4a07bfb260553995ea6d4f",
      "signature": "8r2l+hyZGh8mpCnO8eakenun/pbPn6EpUgWRz7PmXNaHojEMKiM4w2WXR60fuUC6r9s74hQhqyynJ9WI7zdJBw=="
    },
    {
      "path": "trust-surface-report.md",
      "sha256": "d23ec5a6abb39727d6f763cb1498fc764a9b81a3e1793a29f876574b2b6ff226",
      "signature": "tLd8xD3xoZZtIYCjOCIEs6BKIkmalpabNZwN1eNX69+59088+xBniv+aCNekaBwReoCW/uyajRZca6Hcuob6Cw=="
    },
    {
      "path": "verification-result.json",
      "sha256": "32268336a802f1e922a6df3c44246a5dc957deb81d7cf3b35496e58be725e22a",
      "signature": "o1VXE6GjYDY6zwXJmr87ryv2hLL9Hsw94T36tXcpeAXZP2NXhd7vhqF3gokxAfK2lXgkbbkdDGMzejh7agd5AQ=="
    },
    {
      "path": "certificate.json",
      "sha256": "1208f4028c3ac877b2b1d161c93f81e75a233030e54fd83cbb570801be7f7338",
      "signature": "PlFkLMYFkNNEVmzdHPOmFmHtnM8O5jCwuOnVHwcDgEVnOf5KSeGGFYIszo6avnqbiFajr75guXZJlU+6bq3lCg=="
    },
    {
      "path": "replay-bundle.json",
      "sha256": "de62b0ca94454ddbd665476619b1a21cdb7548ab33888534cf9cfad78fba176f",
      "signature": "Z0qR8RghepCgLvsVwZFqrkRaXBhs75LZVxU6x0+v69zF5nR6BqWTHjpcUFzVulAOyK6Ka/BGTa65bwOPUwtRAA=="
    },
    {
      "path": "witness-receipt.json",
      "sha256": "e3447efb9786cdd767beb2e254db7f1720cd9d2b54507caaa98799fabd7f1509",
      "signature": "G4V6CrDNwIfE0mwzDk5dYBtz1PoXHyttMOVN5+PSyu2HmJ6nywgtotY/ivGR5tiaXGYMDv0h8P7cRxXC5f82Dg=="
    },
    {
      "path": "revocation.json",
      "sha256": "b33ec3d98b726267b62575e412fd061f7fee16b45ab5e88431fd7ad2ffc56550",
      "signature": "NBAtCiaG/ragM4B8g7PBbYpqOWe5bgAAxuckBEafQzJg8XdmCAqDw8zmAEgysvsI1tGiu5wv76ETtRmj8575CA=="
    }
  ],
  "note": "Synthetic signature manifest for the public-safe issued ExampleCo corridor."
}
