{
  "signatureBundleId": "exampleco-lifecycle-signature-bundle-2026-03-24",
  "generatedAt": "2026-03-24T04:12:00Z",
  "signer": {
    "signerId": "oc-synthetic-signer",
    "keyId": "oc-synthetic-ed25519-001",
    "algorithm": "Ed25519",
    "publicKeyPath": "exampleco-synthetic-ed25519-public-key.pem"
  },
  "artifacts": [
    {
      "path": "issued-source-change.json",
      "sha256": "11d04269fbb29453125f53786588e4d8ab8c65a76ee729827f329a90be020a5c",
      "signature": "trOMECkv4luMMwqDoyKZxO/4MDYJ2URpOiEIq1NZTezAjPnS0KtHQ6pI9Yt+ycvUFAKdE1qLTsJY+DkadHfhAg=="
    },
    {
      "path": "issued-lifecycle-reverification-required.json",
      "sha256": "225127234b4a1e2f218f374393d227be5bfc9d919dda72a490f8ee564ab596c9",
      "signature": "djfzhFTKQirgUif/Gpp30mV8SURWyfviIn95Ovdi4NUdHr33H7idUXSU/AnVLcl+zBJIrUC0Zu4o+WKv045BBA=="
    },
    {
      "path": "issued-lifecycle-revoked.json",
      "sha256": "687a007be3630886ef27f20b22cf26fd504146e34cf22e658a34750f03c86ceb",
      "signature": "9qdDt5MegJ/wx/QxSqeL7Tb+ZfMZBxgnSALuYfqRY+OZqIUHwmDzuiGKbXH2AmBea+fiUK9eyMyIseP9Y12zAw=="
    },
    {
      "path": "composed-agent-certificate.json",
      "sha256": "950baf4225cfa31f75632018653204104105827df8e04c1a1a91aef5ba436be3",
      "signature": "iT4hhQo3XE7eRjb9TyAGqJaIz0v7peKj6F9A5w7/umqXv6Zt+YSUyiHu8ibk6LFwioCP1fctzbGLHDstbIbMCg=="
    }
  ],
  "note": "Synthetic signature manifest for the public-safe ExampleCo lifecycle artifacts."
}
